run	hypothesis	strategy	budget_s	metric	value	controls	status	note
H4n-1	H4	h4_v2 instrument controls: vdp, averaged quintic, 20 random deg 3/4 (Radau two-sided + DOP853), N1 SDI deg 4	420	confirmed cycles (C1/C2), max cycles (C3), SDI sign changes (N1)	1, 2, max 1, 0	pass	keep	C1-C3 and N1 pass; per-step deadline, 0 count-deadline hits
H4n-2	H4	reconstructed De Maesschalck-Dumortier slow-fast deg-6 family (primary F0, SDI k=3), eps 0.003, counts at top 3 A-curve levels, grid 160	480	max confirmed cycles deg6 (P4 needs >= 4)	1 (all three levels)	fail (P4 fail; N2 incomplete)	crash	lane verdict PARTIAL per preregistration: instrument cannot reach the known regime; P4 failed so the number is not evidence; 2nd/3rd SDI zeros (Y 6.8, 16.6) lie in an A plateau flat to ~1e-16; 14-16 plateau sign changes per count rejected on solver disagreement; no claim about H4
H4n-3	H4	MANUAL diagnostic (not preregistered, not evidence): same family, eps 0.003, a between hump max and plateau	480	confirmed cycles deg6	2	n/a	discard	counter resolves the already-resolved hump (Y 1.937, 2.995); consistent with a resolution limit, does not exclude a reconstruction or eps-regime failure
H4n-4	H4	stage 3b: deg-5 SDI design, seeds 400/401, 1500 trials, scale 1.0 (theory level, no ODE)	-	max SDI sign changes deg5	1	n/a	keep	no red flag against upstream deg<=5 bound (k>=2 would be one); ODE follow-up requires P4, not run
