run	hypothesis	strategy	budget_s	metric	value	controls	status	note
1	H2	PARI qfbclassno, all fundamental D, |D|<=1e7, 7 workers	-	min L(1,chi_D)loglog|D| holdout	0.53577 (D=-2383747)	pass	keep	train min 0.40060 at D=-163; holdout >= train: PASS (weak test, preregistered as such)
2	H5	Hoelder ascent, random init, N=2..6, 40 restarts	1500	best_ratio	2.5 (N>=4); 2.0 (N<=3)	pass	keep	preregistered C*=2 REFUTED
3	H5	exact rational check of N=4 witness	-	exact_ratio	5/2	n/a	keep	rigorous lower bound C* >= 5/2
4	H5	sign-flip local search, N=5, lifted N=4 witness	900	exact_ratio	5/2	n/a	discard	no improvement
5	H5	sign-flip local search, N=5, random start	900	exact_ratio	3041/2048	n/a	discard	single flips too weak
6	H4	random + averaging-structured search, 8 seeds x 1200 s	1200	max confirmed cycles deg5/deg6	2/2 over 96/93 samples (6 of 8 seeds; 2 stopped at ~90 min in stiff samples)	pass	keep	no refutation; low power
7	H5'	Hoelder ascent, fresh seeds, N=6 (40 restarts) and N=7 (12 restarts)	1500/3000	best_ratio	2.5 (N=6), 2.5 (N=7)	pass	keep	confirmatory run: H5' not refuted
8	H2	PARI qfbclassno streaming, all fundamental D, 1e7<|D|<=1e8, 180 chunks, 3 workers, quadclassunit recheck (11700 D)	11984 (chunk CPU-s)	min L(1,chi_D)loglog|D| over (1e7,1e8]	0.567741286418723 (D=-10560643, h=211)	pass	keep	[night 2026-10-07, lane id night-2026-10-07-H2] preregistered PASS (min S >= 2/5); 27356753 fundamental D; h1_count 0; min L 0.20251 (D=-60408307); negative control passes by a thin margin (window k=26 min L 0.20325 < k=23 0.20398, k=25 lower still), weak discriminator; positive control 04:29-04:31Z, chunks 04:32-05:42Z on 2026-10-08
9	H4	h4_v2 instrument controls: vdp, averaged quintic, 20 random deg 3/4 (Radau two-sided + DOP853), N1 SDI deg 4	420	confirmed cycles (C1/C2), max cycles (C3), SDI sign changes (N1)	1, 2, max 1, 0	pass	keep	[night 2026-10-07, lane id H4n-1] C1-C3 and N1 pass; per-step deadline, 0 count-deadline hits; C3 sample 14 had 0 evaluable points (vacuous) and samples 5, 13 lost 22, 27 of 60 points, so about 19 informative samples; N1 scored 344 of 800 trials
10	H4	reconstructed De Maesschalck-Dumortier slow-fast deg-6 family (primary F0, SDI k=3), eps 0.003, counts at top 3 A-curve levels, grid 160	480	max confirmed cycles deg6 (P4 needs >= 4)	1 (all three levels)	fail (P4 not reproduced at eps 0.003; N2 incomplete)	discard	[night 2026-10-07, lane id H4n-2] status relabelled from crash (no instrument control or N2 failed); lane verdict PARTIAL per preregistration; P4 not reproduced at eps 0.003, the only one of 6 preregistered eps run: instrument cannot reach the known regime; P4 failed so the number is not evidence; 2nd/3rd SDI zeros (Y 6.8, 16.6) lie in an A(Y) plateau (A < 0 everywhere; max |A| at Y=2.4655) flat to ~1e-16; 14-16 plateau sign changes per count rejected on solver disagreement; no claim about H4
11	H4	MANUAL diagnostic (not preregistered, not evidence): same family, eps 0.003, a between hump max and plateau	480	confirmed cycles deg6	2	n/a	discard	[night 2026-10-07, lane id H4n-3] counter resolves the already-resolved hump (Y 1.937, 2.995); consistent with a resolution limit, does not exclude a reconstruction or eps-regime failure
12	H4	stage 3b: deg-5 SDI design, seeds 400/401, 1500 trials each, 2157 of 3000 scored (sdi_design drops candidates with < 40 admissible points), scale 1.0 (theory level, no ODE)	-	max SDI sign changes deg5	1	n/a	keep	[night 2026-10-07, lane id H4n-4] no red flag against upstream deg<=5 bound (k>=2 would be one); ODE follow-up requires P4, not run
13	H5'	controls C00 + power control P01 (Haar-free N=4, full pipeline)	420	certified exceedance on Haar-free form	ratio 5 (=N+1), certified	pass	keep	[night 2026-10-07, lane id H5n-1] power control passes; every chunk re-ran controls, all pass
14	H5'	W_N8_witness_x_witness: kron(w4,w4) + rotations/flips, exact integer certifier	420	certified ratio	23/8 (ratio^3 12167/512)	pass	keep	[night 2026-10-07, lane id H5n-2] H5prime REFUTED per preregistered rule; h5_exact recheck 23/8; independent implementation 23/8
15	H5'	exhaustive +-1 search N=1 (E01) and N=2 (32 E2 chunks, all complete, argmax rechecked)	420/chunk	exact max ratio over +-1	N=1: 1; N=2: 2	pass	keep	[night 2026-10-07, lane id H5n-3] exact computer-assisted result
16	H5'	Walsh lifts of N=4 witness (enum N=5,6; samples N=7 1500, N=8 400) + multiscale sign samples N=5,6	420/chunk	max ratio	5/2 (Walsh), 3/4 (N=5 signs), 1/2 (N=6 signs)	pass	discard	[night 2026-10-07, lane id H5n-4] no exceedance
17	H5'	Hoelder ascent: continuation, multiscale signs/gauss, plain gauss, N=5..8 (18 chunks)	420/chunk	best_ratio	between 2.4999186 and 2.4999999999 (per-chunk best)	pass	discard	[night 2026-10-07, lane id H5n-5] local ascent never exceeds 5/2; walsh_top ascents BLOCKED by a KeyError bug (7 chunks)
18	H5'	EXPLORATORY: product rule R(f x g)=H(g)+|T(g)|R(f) + tensor powers of N=2 maximiser g2	-	exact ratio	11/4 (N=6), 23/8 (N=8), 95/32 (N=12, verify_tensor.py independent code only); sup 3	pass	keep	[night 2026-10-07, lane id H5n-6] C* >= 3 by a product rule proved on paper in NOTE.md (not Lean-checked, novelty unchecked); not preregistered
19	H5'	EXPLORATORY: exact Hoelder-marginal upper bound over all real inputs	420	B_N	B_1=1, B_2=2, B_3=5/2	pass	keep	[night 2026-10-07, lane id H5n-7] C_2 = 2 exactly; 2 <= C_3 <= 5/2 (B_3 rests on holder_bound.py alone; B_1, B_2 recomputed independently); Hoelder-marginal reduction is a paper argument; not preregistered
20	D1-definition-hole-bodies	token compare of 45 Comparator definition-hole bodies (9 configs), challenge vs solution import closure, plus eye review	-	verdict counts (mechanical; eye)	mech 37 MATCHES/6 DIFFERS/2 SORRIED/0 NF/0 AMB; eye 6 EQUIVALENT_BY_READING/37 MATCHES/2 SORRIED_IN_CHALLENGE	pass	keep	[night 2026-10-07, lane id D1] controls 98/98; flagged (meaning_pinned=false): sobolevProduct, elementaryPositivityWitness; no Lean elaboration (D2)
21	H-LT1	controls.py rerun in lane (C1-C7)	~360	all_pass	True	pass	keep	[night 2026-10-08, lane LT_A, lane run 1] C5/C7 negative controls exceed L1 by +15.9% at gamma=3; C6 within 2.6e-7 at gamma=1.5; see controls.json
22	H-LT1	g0.75 embed K2P8 chunk, M=320, driver budget 420	520	best_excess	none (killed at 520 s hard timeout, no JSON)	pass	crash	[night 2026-10-08, lane LT_A, lane run 2] campaign.py writes JSON only at exit; seed block 1040-1079 consumed, excluded; see deviations D1
23	H-LT1	g0.75_random_K2P8 m=2 random K=2 P=8 M=320 seeds 1000..; 1 restarts, flagged 0	406	best_excess_R/L1-1	-1.901e-03	pass	keep	[night 2026-10-08, lane LT_A, lane run 3] baseline chunk; chunk median excess -1.90e-03; verdict NO_VIOLATION_FOUND
24	H-LT1	g1.0_embed_K2P8 m=2 embed K=2 P=8 M=160 seeds 1120..; 12 restarts, flagged 0	659	best_excess_R/L1-1	-9.550e-07	pass	keep	[night 2026-10-08, lane LT_A, lane run 4] baseline chunk; chunk median excess -1.96e-06; verdict NO_VIOLATION_FOUND
25	H-LT1	g1.0_random_K2P8 m=2 random K=2 P=8 M=160 seeds 1080..; 12 restarts, flagged 0	707	best_excess_R/L1-1	-2.664e-06	pass	keep	[night 2026-10-08, lane LT_A, lane run 5] baseline chunk; chunk median excess -7.62e-05; verdict NO_VIOLATION_FOUND
26	H-LT1	g1.0_rotpair_K2P8 m=2 rotpair K=2 P=8 M=160 seeds 1160..; 12 restarts, flagged 0	460	best_excess_R/L1-1	-2.429e-06	pass	keep	[night 2026-10-08, lane LT_A, lane run 6] baseline chunk; chunk median excess -5.28e-06; verdict NO_VIOLATION_FOUND
27	H-LT1	g1.0_twist_K2P8 m=2 twist K=2 P=8 M=160 seeds 1200..; 12 restarts, flagged 0	432	best_excess_R/L1-1	-6.211e-07	pass	keep	[night 2026-10-08, lane LT_A, lane run 7] baseline chunk; chunk median excess -1.60e-06; verdict NO_VIOLATION_FOUND
28	H-LT1	g1.25_embed_K2P8 m=2 embed K=2 P=8 M=160 seeds 1280..; 12 restarts, flagged 0	569	best_excess_R/L1-1	-6.399e-07	pass	keep	[night 2026-10-08, lane LT_A, lane run 8] baseline chunk; chunk median excess -1.28e-06; verdict NO_VIOLATION_FOUND
29	H-LT1	g1.25_random_K2P8 m=2 random K=2 P=8 M=160 seeds 1240..; 12 restarts, flagged 0	588	best_excess_R/L1-1	-4.726e-06	pass	keep	[night 2026-10-08, lane LT_A, lane run 9] baseline chunk; chunk median excess -1.97e-05; verdict NO_VIOLATION_FOUND
30	H-LT1	g1.25_rotpair_K2P8 m=2 rotpair K=2 P=8 M=160 seeds 1320..; 12 restarts, flagged 0	509	best_excess_R/L1-1	-1.299e-06	pass	keep	[night 2026-10-08, lane LT_A, lane run 10] baseline chunk; chunk median excess -3.99e-06; verdict NO_VIOLATION_FOUND
31	H-LT1	g1.25_twist_K2P8 m=2 twist K=2 P=8 M=160 seeds 1360..; 12 restarts, flagged 0	527	best_excess_R/L1-1	-2.837e-07	pass	keep	[night 2026-10-08, lane LT_A, lane run 11] baseline chunk; chunk median excess -7.03e-07; verdict NO_VIOLATION_FOUND
32	H-LT1	g1.4_random_K2P8 m=2 random K=2 P=8 M=160 seeds 1400..; 12 restarts, flagged 0	512	best_excess_R/L1-1	-4.765e-06	pass	keep	[night 2026-10-08, lane LT_A, lane run 12] baseline chunk; chunk median excess -1.88e-05; verdict NO_VIOLATION_FOUND
33	H-LT1	g1.4_embed_K2P8 m=2 embed K=2 P=8 M=160 seeds 1440..; 12 restarts, flagged 0	503	best_excess_R/L1-1	-9.521e-07	pass	keep	[night 2026-10-08, lane LT_A, lane run 13] baseline chunk; chunk median excess -1.17e-06; verdict NO_VIOLATION_FOUND
34	H-LT1	g1.4_rotpair_K2P8 m=2 rotpair K=2 P=8 M=160 seeds 1480..; 12 restarts, flagged 0	540	best_excess_R/L1-1	-1.330e-06	pass	keep	[night 2026-10-08, lane LT_A, lane run 14] baseline chunk; chunk median excess -3.16e-06; verdict NO_VIOLATION_FOUND
35	H-LT1	g1.4_twist_K2P8 m=2 twist K=2 P=8 M=160 seeds 1520..; 12 restarts, flagged 0	563	best_excess_R/L1-1	-3.414e-07	pass	keep	[night 2026-10-08, lane LT_A, lane run 15] baseline chunk; chunk median excess -6.62e-07; verdict NO_VIOLATION_FOUND
36	H-LT1	g1.0_random_K3P10 m=2 random K=3 P=10 M=160 seeds 1560..; 12 restarts, flagged 0	565	best_excess_R/L1-1	-9.565e-06	pass	keep	[night 2026-10-08, lane LT_A, lane run 16] baseline chunk; chunk median excess -3.46e-04; verdict NO_VIOLATION_FOUND
37	H-LT1	g1.25_random_K3P10 m=2 random K=3 P=10 M=160 seeds 1600..; 12 restarts, flagged 0	570	best_excess_R/L1-1	-2.152e-05	pass	keep	[night 2026-10-08, lane LT_A, lane run 17] baseline chunk; chunk median excess -4.31e-05; verdict NO_VIOLATION_FOUND
38	H-LT1	g1.25_twist_K2P8 m=2 twist K=2 P=8 M=160 seeds 1680..; 12 restarts, flagged 0	478	best_excess_R/L1-1	-5.068e-07	pass	discard	[night 2026-10-08, lane LT_A, lane run 18] did not raise best (-2.837e-07); chunk median excess -1.07e-06; verdict NO_VIOLATION_FOUND
39	H-LT1	g1.4_random_K3P10 m=2 random K=3 P=10 M=160 seeds 1640..; 12 restarts, flagged 0	516	best_excess_R/L1-1	-1.390e-05	pass	keep	[night 2026-10-08, lane LT_A, lane run 19] baseline chunk; chunk median excess -1.09e-04; verdict NO_VIOLATION_FOUND
40	H-LT1	g1.4_twist_K2P8 m=2 twist K=2 P=8 M=160 seeds 1720..; 12 restarts, flagged 0	467	best_excess_R/L1-1	-3.634e-07	pass	discard	[night 2026-10-08, lane LT_A, lane run 20] did not raise best (-3.414e-07); chunk median excess -5.20e-07; verdict NO_VIOLATION_FOUND
41	H-LT1	g0.75_random_K2P8 m=2 random K=2 P=8 M=320 seeds 1760..; 11 restarts, flagged 0	2690	best_excess_R/L1-1	-1.724e-06	pass	keep	[night 2026-10-08, lane LT_A, lane run 21] raised best from -1.901e-03; chunk median excess -1.40e-05; verdict NO_VIOLATION_FOUND
42	H-LT1	g0.75_embed_K2P8 m=2 embed K=2 P=8 M=320 seeds 1800..; 12 restarts, flagged 0	2363	best_excess_R/L1-1	-8.952e-07	pass	keep	[night 2026-10-08, lane LT_A, lane run 22] baseline chunk; chunk median excess -2.18e-06; verdict NO_VIOLATION_FOUND
43	H-LT1	g0.75_twist_K2P8 m=2 twist K=2 P=8 M=320 seeds 1880..; 12 restarts, flagged 0	2243	best_excess_R/L1-1	-6.036e-07	pass	keep	[night 2026-10-08, lane LT_A, lane run 23] baseline chunk; chunk median excess -1.78e-06; verdict NO_VIOLATION_FOUND
44	H-LT1	g0.75_rotpair_K2P8 m=2 rotpair K=2 P=8 M=320 seeds 1840..; 12 restarts, flagged 0	2390	best_excess_R/L1-1	-3.849e-06	pass	keep	[night 2026-10-08, lane LT_A, lane run 24] baseline chunk; chunk median excess -9.90e-06; verdict NO_VIOLATION_FOUND
45	H-LT1	g0.75_random_K3P10 m=2 random K=3 P=10 M=320 seeds 1920..; 12 restarts, flagged 0	1568	best_excess_R/L1-1	-9.698e-06	pass	keep	[night 2026-10-08, lane LT_A, lane run 25] baseline chunk; chunk median excess -1.23e-03; verdict NO_VIOLATION_FOUND
46	H-LT1	g1.25_twist_K2P8 m=2 twist K=2 P=8 M=160 seeds 1960..; 12 restarts, flagged 0	372	best_excess_R/L1-1	-4.288e-07	pass	discard	[night 2026-10-08, lane LT_A, lane run 26] did not raise best (-2.837e-07); chunk median excess -7.88e-07; verdict NO_VIOLATION_FOUND
47	H-LT1	g1.25_twist_K3P10 m=2 twist K=3 P=10 M=160 seeds 2000..; 12 restarts, flagged 0	404	best_excess_R/L1-1	-9.162e-07	pass	discard	[night 2026-10-08, lane LT_A, lane run 27] baseline chunk; chunk median excess -1.81e-06; verdict NO_VIOLATION_FOUND; status corrected at synthesis: worse than the K2P8 parent, so not 'keep' under the prereg rule
48	H-LT1	g1.4_twist_K2P8 m=2 twist K=2 P=8 M=160 seeds 2040..; 12 restarts, flagged 0	595	best_excess_R/L1-1	-6.266e-07	pass	discard	[night 2026-10-08, lane LT_A, lane run 28] did not raise best (-3.414e-07); chunk median excess -9.99e-07; verdict NO_VIOLATION_FOUND
49	H-LT1	g1.4_twist_K3P10 m=2 twist K=3 P=10 M=160 seeds 2080..; 12 restarts, flagged 0	613	best_excess_R/L1-1	-8.314e-07	pass	discard	[night 2026-10-08, lane LT_A, lane run 29] baseline chunk; chunk median excess -1.42e-06; verdict NO_VIOLATION_FOUND; status corrected at synthesis: worse than the K2P8 parent, so not 'keep' under the prereg rule
50	H-LT1	g1.0_twist_K2P8 m=2 twist K=2 P=8 M=160 seeds 2120..; 12 restarts, flagged 0	837	best_excess_R/L1-1	-6.578e-07	pass	discard	[night 2026-10-08, lane LT_A, lane run 30] did not raise best (-6.211e-07); chunk median excess -1.27e-06; verdict NO_VIOLATION_FOUND
51	H-LT1	g0.75_twist_K2P8 m=2 twist K=2 P=8 M=320 seeds 2160..; 12 restarts, flagged 0	2797	best_excess_R/L1-1	-6.353e-07	pass	discard	[night 2026-10-08, lane LT_A, lane run 31] did not raise best (-6.036e-07); chunk median excess -2.05e-06; verdict NO_VIOLATION_FOUND
52	H-LT1 m=3	campaign control_gamma1.5_m3 K=2 P=8 8 restarts seeds 2000-2007	450x4	max excess R/L1-1	-2.02e-07	pass	keep	[night 2026-10-08, lane LT_B, lane run LT_B-1] NO_VIOLATION_FOUND (not a proof)
53	H-LT1 m=3	campaign g1.0_embed K=2 P=8 8 restarts seeds 2200-2207	450x4	max excess R/L1-1	-2.75e-06	pass	keep	[night 2026-10-08, lane LT_B, lane run LT_B-2] NO_VIOLATION_FOUND (not a proof)
54	H-LT1 m=3	campaign g1.0_random K=2 P=8 8 restarts seeds 2100-2107	450x4	max excess R/L1-1	-1.38e-05	pass	keep	[night 2026-10-08, lane LT_B, lane run LT_B-3] NO_VIOLATION_FOUND (not a proof)
55	H-LT1 m=3	campaign g1.0_twist K=2 P=8 8 restarts seeds 2300-2307	450x4	max excess R/L1-1	-8.23e-07	pass	keep	[night 2026-10-08, lane LT_B, lane run LT_B-4] NO_VIOLATION_FOUND (not a proof)
56	H-LT1 m=3	campaign g1.25_embed K=2 P=8 8 restarts seeds 2500-2507	450x4	max excess R/L1-1	-1.1e-06	pass	keep	[night 2026-10-08, lane LT_B, lane run LT_B-5] NO_VIOLATION_FOUND (not a proof)
57	H-LT1 m=3	campaign g1.25_random K=2 P=8 8 restarts seeds 2400-2407	450x4	max excess R/L1-1	-9.25e-06	pass	keep	[night 2026-10-08, lane LT_B, lane run LT_B-6] NO_VIOLATION_FOUND (not a proof)
58	H-LT1 m=3	campaign g1.25_twist K=2 P=8 8 restarts seeds 2600-2607	450x4	max excess R/L1-1	-8.99e-07	pass	keep	[night 2026-10-08, lane LT_B, lane run LT_B-7] NO_VIOLATION_FOUND (not a proof)
59	H-LT3 g0.75_m1	second_variation P=8 autograd Hessian + FD	-	lambda_max restricted	2.93e-09	pass	keep	[night 2026-10-08, lane LT_B, lane run LT_B-8] NONPOSITIVE_SECOND_VARIATION; pos=0 confirmed=0 thr=6.84e-07
60	H-LT3 g0.75_m2	second_variation P=8 autograd Hessian + FD	-	lambda_max restricted	2.93e-09	pass	keep	[night 2026-10-08, lane LT_B, lane run LT_B-9] NONPOSITIVE_SECOND_VARIATION; pos=0 confirmed=0 thr=6.84e-07
61	H-LT3 g0.75_m3	second_variation P=8 autograd Hessian + FD	-	lambda_max restricted	2.93e-09	pass	keep	[night 2026-10-08, lane LT_B, lane run LT_B-10] NONPOSITIVE_SECOND_VARIATION; pos=0 confirmed=0 thr=6.84e-07
62	H-LT3 g1.0_m1	second_variation P=8 autograd Hessian + FD	-	lambda_max restricted	3.46e-09	pass	keep	[night 2026-10-08, lane LT_B, lane run LT_B-11] NONPOSITIVE_SECOND_VARIATION; pos=0 confirmed=0 thr=1.11e-06
63	H-LT3 g1.0_m2	second_variation P=8 autograd Hessian + FD	-	lambda_max restricted	3.46e-09	pass	keep	[night 2026-10-08, lane LT_B, lane run LT_B-12] NONPOSITIVE_SECOND_VARIATION; pos=0 confirmed=0 thr=1.11e-06
64	H-LT3 g1.0_m3	second_variation P=8 autograd Hessian + FD	-	lambda_max restricted	3.46e-09	pass	keep	[night 2026-10-08, lane LT_B, lane run LT_B-13] NONPOSITIVE_SECOND_VARIATION; pos=0 confirmed=0 thr=1.11e-06
65	H-LT3 g1.25_m1	second_variation P=8 autograd Hessian + FD	-	lambda_max restricted	3.12e-10	pass	keep	[night 2026-10-08, lane LT_B, lane run LT_B-14] NONPOSITIVE_SECOND_VARIATION; pos=0 confirmed=0 thr=1.85e-06
66	H-LT3 g1.25_m2	second_variation P=8 autograd Hessian + FD	-	lambda_max restricted	3.12e-10	pass	keep	[night 2026-10-08, lane LT_B, lane run LT_B-15] NONPOSITIVE_SECOND_VARIATION; pos=0 confirmed=0 thr=1.85e-06
67	H-LT3 g1.25_m3	second_variation P=8 autograd Hessian + FD	-	lambda_max restricted	3.12e-10	pass	keep	[night 2026-10-08, lane LT_B, lane run LT_B-16] NONPOSITIVE_SECOND_VARIATION; pos=0 confirmed=0 thr=1.85e-06
68	H-LT3 g1.4_m1	second_variation P=8 autograd Hessian + FD	-	lambda_max restricted	1.82e-10	pass	keep	[night 2026-10-08, lane LT_B, lane run LT_B-17] NONPOSITIVE_SECOND_VARIATION; pos=0 confirmed=0 thr=2.66e-06
69	H-LT3 g1.4_m2	second_variation P=8 autograd Hessian + FD	-	lambda_max restricted	1.82e-10	pass	keep	[night 2026-10-08, lane LT_B, lane run LT_B-18] NONPOSITIVE_SECOND_VARIATION; pos=0 confirmed=0 thr=2.66e-06
70	H-LT3 g1.4_m3	second_variation P=8 autograd Hessian + FD	-	lambda_max restricted	1.82e-10	pass	keep	[night 2026-10-08, lane LT_B, lane run LT_B-19] NONPOSITIVE_SECOND_VARIATION; pos=0 confirmed=0 thr=2.66e-06
71	H-LT3 g3.0_m1	second_variation P=8 autograd Hessian + FD	-	lambda_max restricted	0.523	pass	keep	[night 2026-10-08, lane LT_B, lane run LT_B-20] NEGATIVE_CONTROL_PASS; pos=9 confirmed=5 thr=1.97e-05; weak detection check: theta0 not critical at gamma=3, negative-control flag bypasses VOID check
72	H-LT3 g3.0_m2	second_variation P=8 autograd Hessian + FD	-	lambda_max restricted	0.523	pass	keep	[night 2026-10-08, lane LT_B, lane run LT_B-21] NEGATIVE_CONTROL_PASS; pos=27 confirmed=5 thr=1.97e-05; weak detection check: theta0 not critical at gamma=3, negative-control flag bypasses VOID check
73	H-LT5	dual kinetic sine-basis search, m=1..3 x N=1..4, 12 restarts/cell, seeds 5000-6111	6600	min excess J/(pi^2/4)-1 over all 144 restarts	+1.49e-08 (m=1,N=1); no restart below pi^2/4	pass	keep	[night 2026-10-08, lane LT_C, lane run LT_C1] NO_VIOLATION_FOUND; cells (1,3),(1,4),(2,4) never within 1e-5 so resolution ~1e-4 there; not a proof
74	H-LT2	commutator statistic C on stored near-maximisers of LT_A/LT_B (snapshot 15:00 UTC)	120	analysed restarts R>=(1-1e-3)L1: 125 of 345; KILLED 59 (52 outside gamma=1.5)	max C = 0.4955; C<0.01 only in 19 rows	pass	discard	[night 2026-10-08, lane LT_C, lane run LT_C2] prereg prediction KILLED on a partial snapshot (125 of 345 near-maximisers had stored parameters). Exploratory, unverified: kills are mixed (tail noise for most embed/twist/rotpair rows; a single-channel non-commuting rotpair gamma=1.4 row; multi-channel random-family rows, some with C below 0.05 at tr W>0.5); 'one constant unitary is too strong' is a hypothesis
75	LT_D-H1	compile 38-file LT closure under LeanMaster Lean v4.34.0-rc2	-	files compiled	14/38 (1 failed, 23 blocked)	pass	keep	[night 2026-10-08, lane LT_D, lane run LT_D-1] FiniteParity.lean:505 Unknown constant Set.equivOfEq (consistent with version drift, not checked against upstream pin); superseded by commits LT_D2b and LT_D3; axiom check not run; challenge elaborates; Elenchus NO_FOOTPRINT x4; not Tier A
