run	hypothesis	strategy	budget_s	metric	value	controls	status	note
1	H-LT1	controls.py rerun in lane (C1-C7)	~360	all_pass	True	pass	keep	C5/C7 negative controls exceed L1 by +15.9% at gamma=3; C6 within 2.6e-7 at gamma=1.5; see controls.json
2	H-LT1	g0.75 embed K2P8 chunk, M=320, driver budget 420	520	best_excess	none (killed at 520 s hard timeout, no JSON)	pass	crash	campaign.py writes JSON only at exit; seed block 1040-1079 consumed, excluded; see deviations D1
3	H-LT1	g0.75_random_K2P8 m=2 random K=2 P=8 M=320 seeds 1000..; 1 restarts, flagged 0	406	best_excess_R/L1-1	-1.901e-03	pass	keep	baseline chunk; chunk median excess -1.90e-03; verdict NO_VIOLATION_FOUND
4	H-LT1	g1.0_embed_K2P8 m=2 embed K=2 P=8 M=160 seeds 1120..; 12 restarts, flagged 0	659	best_excess_R/L1-1	-9.550e-07	pass	keep	baseline chunk; chunk median excess -1.96e-06; verdict NO_VIOLATION_FOUND
5	H-LT1	g1.0_random_K2P8 m=2 random K=2 P=8 M=160 seeds 1080..; 12 restarts, flagged 0	707	best_excess_R/L1-1	-2.664e-06	pass	keep	baseline chunk; chunk median excess -7.62e-05; verdict NO_VIOLATION_FOUND
6	H-LT1	g1.0_rotpair_K2P8 m=2 rotpair K=2 P=8 M=160 seeds 1160..; 12 restarts, flagged 0	460	best_excess_R/L1-1	-2.429e-06	pass	keep	baseline chunk; chunk median excess -5.28e-06; verdict NO_VIOLATION_FOUND
7	H-LT1	g1.0_twist_K2P8 m=2 twist K=2 P=8 M=160 seeds 1200..; 12 restarts, flagged 0	432	best_excess_R/L1-1	-6.211e-07	pass	keep	baseline chunk; chunk median excess -1.60e-06; verdict NO_VIOLATION_FOUND
8	H-LT1	g1.25_embed_K2P8 m=2 embed K=2 P=8 M=160 seeds 1280..; 12 restarts, flagged 0	569	best_excess_R/L1-1	-6.399e-07	pass	keep	baseline chunk; chunk median excess -1.28e-06; verdict NO_VIOLATION_FOUND
9	H-LT1	g1.25_random_K2P8 m=2 random K=2 P=8 M=160 seeds 1240..; 12 restarts, flagged 0	588	best_excess_R/L1-1	-4.726e-06	pass	keep	baseline chunk; chunk median excess -1.97e-05; verdict NO_VIOLATION_FOUND
10	H-LT1	g1.25_rotpair_K2P8 m=2 rotpair K=2 P=8 M=160 seeds 1320..; 12 restarts, flagged 0	509	best_excess_R/L1-1	-1.299e-06	pass	keep	baseline chunk; chunk median excess -3.99e-06; verdict NO_VIOLATION_FOUND
11	H-LT1	g1.25_twist_K2P8 m=2 twist K=2 P=8 M=160 seeds 1360..; 12 restarts, flagged 0	527	best_excess_R/L1-1	-2.837e-07	pass	keep	baseline chunk; chunk median excess -7.03e-07; verdict NO_VIOLATION_FOUND
12	H-LT1	g1.4_random_K2P8 m=2 random K=2 P=8 M=160 seeds 1400..; 12 restarts, flagged 0	512	best_excess_R/L1-1	-4.765e-06	pass	keep	baseline chunk; chunk median excess -1.88e-05; verdict NO_VIOLATION_FOUND
13	H-LT1	g1.4_embed_K2P8 m=2 embed K=2 P=8 M=160 seeds 1440..; 12 restarts, flagged 0	503	best_excess_R/L1-1	-9.521e-07	pass	keep	baseline chunk; chunk median excess -1.17e-06; verdict NO_VIOLATION_FOUND
14	H-LT1	g1.4_rotpair_K2P8 m=2 rotpair K=2 P=8 M=160 seeds 1480..; 12 restarts, flagged 0	540	best_excess_R/L1-1	-1.330e-06	pass	keep	baseline chunk; chunk median excess -3.16e-06; verdict NO_VIOLATION_FOUND
15	H-LT1	g1.4_twist_K2P8 m=2 twist K=2 P=8 M=160 seeds 1520..; 12 restarts, flagged 0	563	best_excess_R/L1-1	-3.414e-07	pass	keep	baseline chunk; chunk median excess -6.62e-07; verdict NO_VIOLATION_FOUND
16	H-LT1	g1.0_random_K3P10 m=2 random K=3 P=10 M=160 seeds 1560..; 12 restarts, flagged 0	565	best_excess_R/L1-1	-9.565e-06	pass	keep	baseline chunk; chunk median excess -3.46e-04; verdict NO_VIOLATION_FOUND
17	H-LT1	g1.25_random_K3P10 m=2 random K=3 P=10 M=160 seeds 1600..; 12 restarts, flagged 0	570	best_excess_R/L1-1	-2.152e-05	pass	keep	baseline chunk; chunk median excess -4.31e-05; verdict NO_VIOLATION_FOUND
18	H-LT1	g1.25_twist_K2P8 m=2 twist K=2 P=8 M=160 seeds 1680..; 12 restarts, flagged 0	478	best_excess_R/L1-1	-5.068e-07	pass	discard	did not raise best (-2.837e-07); chunk median excess -1.07e-06; verdict NO_VIOLATION_FOUND
19	H-LT1	g1.4_random_K3P10 m=2 random K=3 P=10 M=160 seeds 1640..; 12 restarts, flagged 0	516	best_excess_R/L1-1	-1.390e-05	pass	keep	baseline chunk; chunk median excess -1.09e-04; verdict NO_VIOLATION_FOUND
20	H-LT1	g1.4_twist_K2P8 m=2 twist K=2 P=8 M=160 seeds 1720..; 12 restarts, flagged 0	467	best_excess_R/L1-1	-3.634e-07	pass	discard	did not raise best (-3.414e-07); chunk median excess -5.20e-07; verdict NO_VIOLATION_FOUND
21	H-LT1	g0.75_random_K2P8 m=2 random K=2 P=8 M=320 seeds 1760..; 11 restarts, flagged 0	2690	best_excess_R/L1-1	-1.724e-06	pass	keep	raised best from -1.901e-03; chunk median excess -1.40e-05; verdict NO_VIOLATION_FOUND
22	H-LT1	g0.75_embed_K2P8 m=2 embed K=2 P=8 M=320 seeds 1800..; 12 restarts, flagged 0	2363	best_excess_R/L1-1	-8.952e-07	pass	keep	baseline chunk; chunk median excess -2.18e-06; verdict NO_VIOLATION_FOUND
23	H-LT1	g0.75_twist_K2P8 m=2 twist K=2 P=8 M=320 seeds 1880..; 12 restarts, flagged 0	2243	best_excess_R/L1-1	-6.036e-07	pass	keep	baseline chunk; chunk median excess -1.78e-06; verdict NO_VIOLATION_FOUND
24	H-LT1	g0.75_rotpair_K2P8 m=2 rotpair K=2 P=8 M=320 seeds 1840..; 12 restarts, flagged 0	2390	best_excess_R/L1-1	-3.849e-06	pass	keep	baseline chunk; chunk median excess -9.90e-06; verdict NO_VIOLATION_FOUND
25	H-LT1	g0.75_random_K3P10 m=2 random K=3 P=10 M=320 seeds 1920..; 12 restarts, flagged 0	1568	best_excess_R/L1-1	-9.698e-06	pass	keep	baseline chunk; chunk median excess -1.23e-03; verdict NO_VIOLATION_FOUND
26	H-LT1	g1.25_twist_K2P8 m=2 twist K=2 P=8 M=160 seeds 1960..; 12 restarts, flagged 0	372	best_excess_R/L1-1	-4.288e-07	pass	discard	did not raise best (-2.837e-07); chunk median excess -7.88e-07; verdict NO_VIOLATION_FOUND
27	H-LT1	g1.25_twist_K3P10 m=2 twist K=3 P=10 M=160 seeds 2000..; 12 restarts, flagged 0	404	best_excess_R/L1-1	-9.162e-07	pass	keep	baseline chunk; chunk median excess -1.81e-06; verdict NO_VIOLATION_FOUND
28	H-LT1	g1.4_twist_K2P8 m=2 twist K=2 P=8 M=160 seeds 2040..; 12 restarts, flagged 0	595	best_excess_R/L1-1	-6.266e-07	pass	discard	did not raise best (-3.414e-07); chunk median excess -9.99e-07; verdict NO_VIOLATION_FOUND
29	H-LT1	g1.4_twist_K3P10 m=2 twist K=3 P=10 M=160 seeds 2080..; 12 restarts, flagged 0	613	best_excess_R/L1-1	-8.314e-07	pass	keep	baseline chunk; chunk median excess -1.42e-06; verdict NO_VIOLATION_FOUND
30	H-LT1	g1.0_twist_K2P8 m=2 twist K=2 P=8 M=160 seeds 2120..; 12 restarts, flagged 0	837	best_excess_R/L1-1	-6.578e-07	pass	discard	did not raise best (-6.211e-07); chunk median excess -1.27e-06; verdict NO_VIOLATION_FOUND
31	H-LT1	g0.75_twist_K2P8 m=2 twist K=2 P=8 M=320 seeds 2160..; 12 restarts, flagged 0	2797	best_excess_R/L1-1	-6.353e-07	pass	discard	did not raise best (-6.036e-07); chunk median excess -2.05e-06; verdict NO_VIOLATION_FOUND
